{
    "$schema": "http://json-schema.org/draft-07/schema#",
    "$id": "https://raw.githubusercontent.com/Astraxical/displau/master/config/schema.json",
    "title": "7 Segment Display Timer Configuration",
    "description": "Schema for timer configuration files",
    "type": "object",
    "required": [
        "id",
        "target_time"
    ],
    "properties": {
        "id": {
            "type": "string",
            "description": "Unique identifier for the timer (used in filename)",
            "pattern": "^[a-z0-9-]+$",
            "minLength": 1,
            "maxLength": 50
        },
        "display_name": {
            "type": "string",
            "description": "Human-readable name shown in the selector",
            "minLength": 1,
            "maxLength": 100
        },
        "description": {
            "type": "string",
            "description": "Description of the timer",
            "maxLength": 500
        },
        "target_time": {
            "type": "string",
            "description": "ISO 8601 datetime when timer ends",
            "pattern": "^\\d{4}-\\d{2}-\\d{2}T\\d{2}:\\d{2}:\\d{2}$"
        },
        "start_time": {
            "type": "string",
            "description": "ISO 8601 datetime when timer starts",
            "pattern": "^\\d{4}-\\d{2}-\\d{2}T\\d{2}:\\d{2}:\\d{2}$"
        },
        "direction": {
            "type": "string",
            "description": "Timer direction",
            "enum": ["down", "up"],
            "default": "down"
        },
        "min_value": {
            "type": "number",
            "description": "Minimum value for countdown",
            "default": 0
        },
        "max_value": {
            "oneOf": [
                {"type": "number"},
                {"type": "null"}
            ],
            "description": "Maximum value (null for unlimited)",
            "default": null
        },
        "on_expire": {
            "type": "string",
            "description": "Action on expiry",
            "enum": ["stop", "continue", "hide"],
            "default": "stop"
        },
        "display_on_expire": {
            "type": "boolean",
            "description": "Whether to show in selector after expiry",
            "default": true
        },
        "tags": {
            "type": "array",
            "description": "Tags for categorization",
            "items": {
                "type": "string"
            }
        },
        "category": {
            "type": "string",
            "description": "Category name"
        },
        "color_theme": {
            "type": "string",
            "description": "Color theme identifier",
            "default": "progress"
        },
        "color_transition_table": {
            "type": "array",
            "description": "Custom color transition table",
            "items": {
                "type": "object",
                "required": ["ratio", "color"],
                "properties": {
                    "ratio": {"type": "number"},
                    "color": {
                        "type": "string",
                        "pattern": "^#[0-9a-fA-F]{6}$"
                    }
                }
            }
        },
        "show_milliseconds": {
            "type": "boolean",
            "description": "Show milliseconds in display",
            "default": true
        },
        "timezone": {
            "type": "string",
            "description": "Timezone identifier",
            "default": "UTC"
        }
    },
    "additionalProperties": false
}
