{
    "id": "assembly",
    "display_name": "Assembly Countdown",
    "description": "Countdown to assembly event",
    "target_time": "2026-03-24T05:30:00",
    "start_time": "2026-03-21T23:54:57",
    "direction": "down",
    "min_value": 0,
    "max_value": null,
    "on_expire": "stop",
    "display_on_expire": false,
    "tags": [
        "event",
        "work",
        "important"
    ],
    "category": "work",
    "color_theme": "progress",
    "show_milliseconds": true,
    "timezone": "UTC+8"
}
