{
    "id": "birthday",
    "display_name": "Birthday Countdown",
    "description": "Annual birthday celebration",
    "target_time": "2026-05-16T08:00:00",
    "start_time": "2026-05-01T08:00:00",
    "direction": "down",
    "min_value": 0,
    "max_value": null,
    "on_expire": "stop",
    "display_on_expire": false,
    "tags": ["personal", "birthday", "celebration"],
    "category": "personal",
    "color_theme": "progress",
    "show_milliseconds": true,
    "timezone": "UTC+8"
}
