{
    "id": "your-timer-name",
    "display_name": "Your Timer Name",
    "description": "A description of this timer",
    "target_time": "2026-12-31T23:59:59",
    "start_time": "2026-01-01T00:00:00",
    "direction": "down",
    "min_value": 0,
    "max_value": null,
    "on_expire": "stop",
    "display_on_expire": false,
    "tags": ["event", "countdown"],
    "category": "personal",
    "color_theme": "progress",
    "color_transition_table": [
        {"ratio": 1.0, "color": "#0088ff"},
        {"ratio": 0.9, "color": "#00aaff"},
        {"ratio": 0.8, "color": "#00ccff"},
        {"ratio": 0.75, "color": "#00ff00"},
        {"ratio": 0.6, "color": "#80ff00"},
        {"ratio": 0.5, "color": "#ffff00"},
        {"ratio": 0.4, "color": "#ffcc00"},
        {"ratio": 0.3, "color": "#ffaa00"},
        {"ratio": 0.25, "color": "#ff8800"},
        {"ratio": 0.2, "color": "#ff6600"},
        {"ratio": 0.1, "color": "#ff4400"},
        {"ratio": 0.0, "color": "#ff0000"},
        {"ratio": -0.25, "color": "#ff0080"},
        {"ratio": -0.5, "color": "#ee82ee"},
        {"ratio": -0.75, "color": "#c060ff"},
        {"ratio": -1.0, "color": "#8b00ff"}
    ],
    "show_milliseconds": true,
    "timezone": "UTC"
}
