{
    "id": "execution",
    "display_name": "Execution",
    "description": "Project execution phase",
    "target_time": "2026-04-15T08:00:00",
    "start_time": "2026-03-15T08:00:00",
    "direction": "down",
    "min_value": 0,
    "max_value": null,
    "on_expire": "stop",
    "display_on_expire": false,
    "tags": ["work", "project", "deadline"],
    "category": "work",
    "color_theme": "progress",
    "show_milliseconds": true,
    "timezone": "UTC+8"
}
