{
    "id": "limerance-dead",
    "display_name": "Limerance Dead",
    "description": "Limerance deadline",
    "target_time": "2026-03-24T00:00:00",
    "start_time": "2026-03-17T00:00:00",
    "direction": "down",
    "min_value": 0,
    "max_value": null,
    "on_expire": "stop",
    "display_on_expire": false,
    "tags": ["deadline", "personal", "important"],
    "category": "personal",
    "color_theme": "progress",
    "show_milliseconds": true,
    "timezone": "UTC"
}
