{
    "id": "your-timer-name",
    "display_name": "Your Timer Name",
    "description": "A description of this timer",
    "target_time": "2026-12-31T23:59:59",
    "start_time": "2026-01-01T00:00:00",
    "direction": "down",
    "min_value": 0,
    "max_value": null,
    "on_expire": "stop",
    "display_on_expire": false,
    "tags": ["event", "countdown"],
    "category": "personal",
    "color_theme": "progress",
    "color_transition_table": [
        {"ratio": 1.0, "color": "#0088ff"},
        {"ratio": 0.75, "color": "#00ff00"},
        {"ratio": 0.5, "color": "#ffff00"},
        {"ratio": 0.25, "color": "#ff8800"},
        {"ratio": 0.0, "color": "#ff0000"}
    ],
    "show_milliseconds": true,
    "timezone": "UTC"
}
