{
    "id": "execution",
    "display_name": "Execution",
    "description": "Project execution phase",
    "target_time": "2026-04-15T00:00:00",
    "start_time": "2026-03-15T00:00:00",
    "direction": "down",
    "min_value": 0,
    "max_value": null,
    "on_expire": "stop",
    "display_on_expire": false,
    "tags": ["work", "project", "deadline"],
    "category": "work",
    "color_theme": "red",
    "color_transition_table": [
        {"ratio": 1.0, "color": "#ff4444"},
        {"ratio": 0.5, "color": "#ff0000"},
        {"ratio": 0.0, "color": "#cc0000"}
    ],
    "show_milliseconds": true,
    "timezone": "UTC"
}
